{
  "id": "apple-fr-azerty",
  "name": {
    "en": "FR MagicKeyboard",
    "fr": "FR MagicKeyboard"
  },
  "locale": "fr-FR",
  "localeId": "0000040c",
  "dllName": "kbdaplfr",
  "description": {
    "en": "French AZERTY layout matching Apple Magic Keyboard keycaps. Fixes the mismatch between Apple's key labels and Windows' default French layout.",
    "fr": "Disposition AZERTY française correspondant aux inscriptions du Magic Keyboard Apple. Corrige le décalage entre les symboles imprimés sur les touches Apple et la disposition française par défaut de Windows."
  },
  "detectionKeys": [
    {
      "eventCode": "Backquote",
      "prompt": {
        "en": "Press the key to the LEFT of the 1 key (top-left area)",
        "fr": "Appuyez sur la touche à GAUCHE du 1 (en haut à gauche)"
      },
      "expectedBase": "@"
    },
    {
      "eventCode": "Digit8",
      "prompt": {
        "en": "Press the key between 7 and 9 on the number row",
        "fr": "Appuyez sur la touche entre 7 et 9 sur la rangée des chiffres"
      },
      "expectedBase": "!"
    },
    {
      "eventCode": "Digit6",
      "prompt": {
        "en": "Press the key between 5 and 7 on the number row",
        "fr": "Appuyez sur la touche entre 5 et 7 sur la rangée des chiffres"
      },
      "expectedBase": "\u00a7"
    },
    {
      "eventCode": "Minus",
      "prompt": {
        "en": "Press the key to the RIGHT of the 0 key, two keys before Backspace",
        "fr": "Appuyez sur la touche à DROITE du 0, deux touches avant Retour"
      },
      "expectedBase": ")"
    }
  ],
  "keys": {
    "29": { "vk": "VK_OEM_102",  "cap": "0", "base": "003c", "shift": "003e", "ctrl": "-1", "altgr": "2264", "altgrShift": "2265" },
    "02": { "vk": "VK_1",        "cap": "0", "base": "0026", "shift": "0031", "ctrl": "-1", "altgr": "-1",   "altgrShift": "-1" },
    "03": { "vk": "VK_2",        "cap": "0", "base": "00e9", "shift": "0032", "ctrl": "-1", "altgr": "00eb", "altgrShift": "-1" },
    "04": { "vk": "VK_3",        "cap": "0", "base": "0022", "shift": "0033", "ctrl": "-1", "altgr": "201c", "altgrShift": "201d" },
    "05": { "vk": "VK_4",        "cap": "0", "base": "0027", "shift": "0034", "ctrl": "-1", "altgr": "2018", "altgrShift": "2019" },
    "06": { "vk": "VK_5",        "cap": "0", "base": "0028", "shift": "0035", "ctrl": "-1", "altgr": "007b", "altgrShift": "005b" },
    "07": { "vk": "VK_6",        "cap": "0", "base": "00a7", "shift": "0036", "ctrl": "-1", "altgr": "00b6", "altgrShift": "00e5" },
    "08": { "vk": "VK_7",        "cap": "0", "base": "00e8", "shift": "0037", "ctrl": "-1", "altgr": "00ab", "altgrShift": "00bb" },
    "09": { "vk": "VK_8",        "cap": "0", "base": "0021", "shift": "0038", "ctrl": "-1", "altgr": "00a1", "altgrShift": "-1" },
    "0a": { "vk": "VK_9",        "cap": "0", "base": "00e7", "shift": "0039", "ctrl": "-1", "altgr": "00c7", "altgrShift": "00c1" },
    "0b": { "vk": "VK_0",        "cap": "0", "base": "00e0", "shift": "0030", "ctrl": "-1", "altgr": "00f8", "altgrShift": "00d8" },
    "0c": { "vk": "VK_OEM_4",    "cap": "0", "base": "0029", "shift": "00b0", "ctrl": "-1", "altgr": "007d", "altgrShift": "005d" },
    "0d": { "vk": "VK_OEM_PLUS", "cap": "0", "base": "002d", "shift": "005f", "ctrl": "-1", "altgr": "2014", "altgrShift": "00b1" },

    "10": { "vk": "VK_A",        "cap": "1", "base": "0061", "shift": "0041", "ctrl": "-1", "altgr": "00e6", "altgrShift": "00c6" },
    "11": { "vk": "VK_Z",        "cap": "1", "base": "007a", "shift": "005a", "ctrl": "-1", "altgr": "00e2", "altgrShift": "00c2" },
    "12": { "vk": "VK_E",        "cap": "1", "base": "0065", "shift": "0045", "ctrl": "-1", "altgr": "00ea", "altgrShift": "00ca" },
    "13": { "vk": "VK_R",        "cap": "1", "base": "0072", "shift": "0052", "ctrl": "-1", "altgr": "-1",   "altgrShift": "-1" },
    "14": { "vk": "VK_T",        "cap": "1", "base": "0074", "shift": "0054", "ctrl": "-1", "altgr": "-1",   "altgrShift": "-1" },
    "15": { "vk": "VK_Y",        "cap": "1", "base": "0079", "shift": "0059", "ctrl": "-1", "altgr": "00fa", "altgrShift": "00da" },
    "16": { "vk": "VK_U",        "cap": "1", "base": "0075", "shift": "0055", "ctrl": "-1", "altgr": "-1",   "altgrShift": "-1" },
    "17": { "vk": "VK_I",        "cap": "1", "base": "0069", "shift": "0049", "ctrl": "-1", "altgr": "00ee", "altgrShift": "00ce" },
    "18": { "vk": "VK_O",        "cap": "1", "base": "006f", "shift": "004f", "ctrl": "-1", "altgr": "0153", "altgrShift": "0152" },
    "19": { "vk": "VK_P",        "cap": "1", "base": "0070", "shift": "0050", "ctrl": "-1", "altgr": "-1",   "altgrShift": "-1" },
    "1a": { "vk": "VK_OEM_6",    "cap": "0", "base": "005e@", "shift": "00a8@", "ctrl": "-1", "altgr": "00f4", "altgrShift": "-1" },
    "1b": { "vk": "VK_OEM_1",    "cap": "0", "base": "0024", "shift": "002a", "ctrl": "-1", "altgr": "20ac", "altgrShift": "00a5" },

    "1e": { "vk": "VK_Q",        "cap": "1", "base": "0071", "shift": "0051", "ctrl": "-1", "altgr": "-1",   "altgrShift": "-1" },
    "1f": { "vk": "VK_S",        "cap": "1", "base": "0073", "shift": "0053", "ctrl": "-1", "altgr": "-1",   "altgrShift": "-1" },
    "20": { "vk": "VK_D",        "cap": "1", "base": "0064", "shift": "0044", "ctrl": "-1", "altgr": "-1",   "altgrShift": "-1" },
    "21": { "vk": "VK_F",        "cap": "1", "base": "0066", "shift": "0046", "ctrl": "-1", "altgr": "-1",   "altgrShift": "-1" },
    "22": { "vk": "VK_G",        "cap": "1", "base": "0067", "shift": "0047", "ctrl": "-1", "altgr": "-1",   "altgrShift": "-1" },
    "23": { "vk": "VK_H",        "cap": "1", "base": "0068", "shift": "0048", "ctrl": "-1", "altgr": "-1",   "altgrShift": "-1" },
    "24": { "vk": "VK_J",        "cap": "1", "base": "006a", "shift": "004a", "ctrl": "-1", "altgr": "-1",   "altgrShift": "-1" },
    "25": { "vk": "VK_K",        "cap": "1", "base": "006b", "shift": "004b", "ctrl": "-1", "altgr": "-1",   "altgrShift": "-1" },
    "26": { "vk": "VK_L",        "cap": "1", "base": "006c", "shift": "004c", "ctrl": "-1", "altgr": "007c", "altgrShift": "005c" },
    "27": { "vk": "VK_M",        "cap": "1", "base": "006d", "shift": "004d", "ctrl": "-1", "altgr": "00b5", "altgrShift": "00d3" },
    "28": { "vk": "VK_OEM_3",    "cap": "0", "base": "00f9", "shift": "0025", "ctrl": "-1", "altgr": "-1",   "altgrShift": "-1" },
    "2b": { "vk": "VK_OEM_5",    "cap": "0", "base": "0060@", "shift": "00a3", "ctrl": "-1", "altgr": "0040", "altgrShift": "-1" },

    "56": { "vk": "VK_OEM_7",    "cap": "0", "base": "0040", "shift": "0023", "ctrl": "-1", "altgr": "2022", "altgrShift": "-1" },
    "2c": { "vk": "VK_W",        "cap": "1", "base": "0077", "shift": "0057", "ctrl": "-1", "altgr": "-1",   "altgrShift": "-1" },
    "2d": { "vk": "VK_X",        "cap": "1", "base": "0078", "shift": "0058", "ctrl": "-1", "altgr": "-1",   "altgrShift": "-1" },
    "2e": { "vk": "VK_C",        "cap": "1", "base": "0063", "shift": "0043", "ctrl": "-1", "altgr": "00a9", "altgrShift": "-1" },
    "2f": { "vk": "VK_V",        "cap": "1", "base": "0076", "shift": "0056", "ctrl": "-1", "altgr": "-1",   "altgrShift": "-1" },
    "30": { "vk": "VK_B",        "cap": "1", "base": "0062", "shift": "0042", "ctrl": "-1", "altgr": "-1",   "altgrShift": "-1" },
    "31": { "vk": "VK_N",        "cap": "1", "base": "006e", "shift": "004e", "ctrl": "-1", "altgr": "007e@","altgrShift": "-1" },
    "32": { "vk": "VK_OEM_COMMA","cap": "0", "base": "002c", "shift": "003f", "ctrl": "-1", "altgr": "221e", "altgrShift": "00bf" },
    "33": { "vk": "VK_OEM_PERIOD","cap": "0","base": "003b", "shift": "002e", "ctrl": "-1", "altgr": "2026", "altgrShift": "-1" },
    "34": { "vk": "VK_OEM_2",    "cap": "0", "base": "003a", "shift": "002f", "ctrl": "-1", "altgr": "00f7", "altgrShift": "005c" },
    "35": { "vk": "VK_OEM_8",    "cap": "0", "base": "003d", "shift": "002b", "ctrl": "-1", "altgr": "2260", "altgrShift": "-1" },

    "39": { "vk": "VK_SPACE",    "cap": "0", "base": "0020", "shift": "0020", "ctrl": "0020", "altgr": "00a0", "altgrShift": "-1" }
  },
  "deadKeys": {
    "005e": {
      "name": "CIRCUMFLEX ACCENT",
      "combinations": {
        "0061": "00e2",
        "0065": "00ea",
        "0069": "00ee",
        "006f": "00f4",
        "0075": "00fb",
        "0041": "00c2",
        "0045": "00ca",
        "0049": "00ce",
        "004f": "00d4",
        "0055": "00db",
        "0020": "005e"
      }
    },
    "00a8": {
      "name": "DIAERESIS",
      "combinations": {
        "0061": "00e4",
        "0065": "00eb",
        "0069": "00ef",
        "006f": "00f6",
        "0075": "00fc",
        "0079": "00ff",
        "0041": "00c4",
        "0045": "00cb",
        "0049": "00cf",
        "004f": "00d6",
        "0055": "00dc",
        "0020": "00a8"
      }
    },
    "0060": {
      "name": "GRAVE ACCENT",
      "combinations": {
        "0061": "00e0",
        "0065": "00e8",
        "0069": "00ec",
        "006f": "00f2",
        "0075": "00f9",
        "0041": "00c0",
        "0045": "00c8",
        "0049": "00cc",
        "004f": "00d2",
        "0055": "00d9",
        "0020": "0060"
      }
    },
    "007e": {
      "name": "TILDE",
      "combinations": {
        "006e": "00f1",
        "004e": "00d1",
        "006f": "00f5",
        "004f": "00d5",
        "0061": "00e3",
        "0041": "00c3",
        "0020": "007e"
      }
    }
  }
}
